postDates,tweets,sentiment_label,polarity_score
2022-12-30T15:04:46.000Z, Oferta de Carreras Cantidad de Titulos Acreditados Convenios Internacionales Numero de Matriculados Indic de Innovacion Actualizacion de Malla Curricular Infraestructura Publicaciones de la Univ Oferta de DiplomadosMaestrias Trayectoria,pos,0.25
2022-12-26T21:13:49.000Z,El y de diciembre se llevó a cabo las XIII Jornadas de Innovación Docente de la Fue muy enriquecedor ver los distintos proyectos implementados y tratar de aportar de aportar mi granito de arena desde la ,pos,0.25
2022-12-22T13:04:42.000Z,Cierre de año compartiendo con colegas que formamos parte de la #economía #innovación,neu,0
2022-12-21T01:45:24.000Z,Hemos diseñado una campaña Política Digital buscando darles una OPCIÓN distinta a los compatriotas correligionarios bajo ejes bien definidos INNOVACIÓN TECNOLOGIA Y EMPRENDIMIENTOS que no fue simplemente un slogan,pos,0.917
2022-12-19T16:46:11.000Z,Nuevo integrante de la familia Mazzei Seguimos creyendo en la innovación y no vamos a parar,pos,0.575
2022-12-17T01:40:36.000Z,Proyectemos juntos apostemos a la innovación tecnología y emprendimientos de bases tecnológicas Votá a la lista opción que vamos a estar mejor En Central VAMOS A ESTAR MEJOR ,pos,0.41300000000000003
2022-12-03T08:40:43.000Z,Fue un honor formar parte del evento de presentación del Mapeo de Inversiones ODS en Paraguay Principales Resultados junto con El mapeo es una herramienta indispensable para lograr más innovación y buscar más financiación sostenible,pos,1.702
2022-12-02T22:53:57.000Z,#SimposioInternacional #CePeInnovación Prospectiva y Estudio de Futuro y dic En el marco del #DíaMundialdelosFuturos #Unesco,neu,0
2022-12-02T16:12:57.000Z,El día de ayer estuvimos recorriendo la #ciudad de #Itauguá llevando los proyectos de INNOVACIÓN TECNOLOGÍA Y EMPRENDIMIENTO Queremos ser parte de un futuro mejor donde innovemos la Política con proyectos concretos,neu,0.0
2022-12-02T15:16:07.000Z,#SimposioInternacional #CePeInnovación Prospectiva y Estudio de Futuro y dic En el marco del #DíaMundialdelosFuturos #UNESCO,neu,0
2022-12-02T13:22:12.000Z,Fue un honor formar parte del evento de presentación del Mapeo de Inversiones ODS en Paraguay Principales Resultados junto con El mapeo es una herramienta indispensable para lograr más innovación y buscar más financiación sostenible,pos,1.702
2022-12-02T13:03:01.000Z, El futuro del Paraguay vamos a construir con la fuerza del trabajo de una generación que siente y palpita un Paraguay del futuro con tecnología innovación e inversiones #PettengillSenador #Lista #Opción #FuerzaRepublicana #LaFuerzadelTrabajo #Atodamáquina,neg,-0.525
2022-11-30T04:14:56.000Z,Nunca dejamos que elijan por nosotros una lista de películas que más nos gustan entonces porqué vas a dejar que otros decidan por vos a quién votar y determinar tu futuroVamos a trabajar en base a tres ejes Innovación Tecnología y emprendimiento,pos,0.506
2022-11-29T14:56:49.000Z,Innovación ciencia y tecnología para fortalecer la lucha contra las drogasLa recibió hoy este laboratorio móvil donado por la embajada de Muchas gracias al Sr Embajador por apoyarnos a dar este valioso paso hacia el futuro,pos,1.351
2022-11-24T13:14:16.000Z,Lambare sumándose al equipo de INNOVACIÓN TECNOLOGÍA y EMPRENDIMIENTOS de bases tecnológicas ,pos,0.5940000000000001
2022-11-20T15:35:06.000Z,MAAAAAN CARTELES CON QR JJAJAJAJAJAJAJ #INNOVACIÓN,neu,0
2022-10-27T23:55:18.000Z,Gestión de Proyectos Gestión de Calidad Gestión de la Innovación El mundo de los negocios avanza y las empresas deben adaptarse con el apoyo de espacios especializados que hoy más que nunca están disponibles en el país #MiPYMECOMPITE #UEenParaguay,pos,1.8920000000000001
2022-10-24T19:19:40.000Z,La creatividad impulsando la innovación y el crecimiento empresarial,pos,0.625
2022-10-24T18:14:15.000Z,Invitados𝑫𝒓 𝑴𝒂𝒓𝒊𝒐 𝑴𝒂𝒓𝒕𝒊́𝒏𝒆𝒛 Director General 𝑩𝒊𝒐𝒒 𝑨𝒓𝒊𝒆𝒍 𝑰𝒏𝒔𝒂𝒖𝒓𝒓𝒂𝒍𝒅𝒆 Asesor de Innovación e Imagen IICSUNA 𝑴𝒂𝒈 𝑷𝒂𝒛 𝑩𝒂𝒓𝒆𝒊𝒓𝒐 Directora de Desarrollo Capital Humano para ID CONACYT Por Paraguay TV ,pos,0.781
2022-10-20T20:36:37.000Z,Serán encargados de guiar este circuito profesionales de la Agencia de Innovación Urbana y FIIAPP ,neu,0
2022-10-18T13:07:02.000Z,La Dra Alicia Pomata Dir de PRONAC presentando en Ginebra el Proyecto #UnidosPorLaSalydYLaVida implementado por FUNCA en alianza con MSPBS gracias a la Convocatoria de Innovación Social del #deteccionprecozsalvavidas,pos,0.743
2022-10-18T12:15:37.000Z,Carlitos para ser Pte de Cerro no necesitas peso solo innovación relaciones internacionales creatividad la plata no va a salir del Bolsillo del Pte Sino de las gestiones que haga con empresas ensamos alreves equivocadamente Xq cerro le debe a los bcos Se responde solo,pos,0.06299999999999994
2022-09-20T14:32:47.000Z,Xplora brinda la oportunidad a las empresas de introducirse al mundo de la innovación abierta Conectá a tu empresa con startups y desarrollá soluciones ágiles e innovadoras Formato virtual Inscripción exonerada Inscripciones en ,pos,1.448
2022-09-19T19:16:21.000Z,Esto fue posible gracias al apoyo la colaboración y puesta en marcha de la academia la sede Itapua la Coordinadora Pya de Abogados la a través del programa de Innovación y a nuestra Empresa Social Kuña Pepo,pos,1.343
2022-09-19T18:06:26.000Z,Fecha importante en la agenda del movimiento STEM e innovación de la región este del País Hoy es el lanzamiento del proyecto Pequeños Inventores iniciativa liderada por Piensa Osmar Quiñónez y acompañamos entre los actores del ecosistema ,pos,0.6
2022-09-19T01:37:55.000Z,Compartimos un poco de lo vivido en el Foro ° Jóvenes y Emprendedores Medio ambiente innovación tecnología medioambiente y finanzas son algunos de los ejes del evento #PatoOjedaPresidente#Listaopcion#SantiPeñaPresidente#HCPresidenteANR,neg,-0.5
2022-09-17T20:59:31.000Z,Así como a un colegio público realmente no podes imponerle una malla curricular de religión así también las escuelas sobre todo las públicas están para el conocimiento ciencias de diferentes ramas tecnología innovación arte historia etc ,pos,1.001
2022-09-14T19:32:45.000Z,¡Qué gusto celebrar la innovación el liderazgo y la trayectoria de una compañía global como #talento #capitalhumano #soluciones,pos,1.071
2022-08-26T12:57:59.000Z,El miércoles pasado culminó el primer bootcamp exclusivo para mujeres de Penguin Academy con un Hackathon que abarcó todo el fin de semana El desafío de la Hackathon fue Cómo fortalecer los emprendimientos de las mujeres por medio de la innovación en tecnología,neg,-0.08700000000000002
2022-08-24T23:05:29.000Z,Cómo fortalecer los emprendimientos de las mujeres por medio de la innovación en tecnología,neu,0
2022-08-20T15:54:11.000Z,#MateoSalvatto CEO y Cofundador de Asteroid Technologies Coordinador de Innovación #EscuelasORT en #Argentina presente en Paraguay ,pos,0.25
2022-08-19T18:18:57.000Z,El challenge de nuestra hackathon este mes es Cómo fortalecer los emprendimientos de las mujeres por medio de la innovación en tecnologíaQué es más increíble que mujeres ayudando a mujeres ,pos,0.7330000000000001
2022-07-09T16:31:32.000Z,Te invitamos a conocer nuestro Stand en la Donde podrán participar todos los días de diversas charlas Master Class de Cocina y cursos muy interesantes De lanzamientos de programas de formación con innovación y desarrollo Visítanos pues,pos,0.813
2022-07-06T12:19:49.000Z,Sin rodeos La nueva decana no pierde un minuto y mantiene varias reuniones técnicas con el estamento docente en Quiindy Innovación en propuestas para egresados y nuevos paradigmas en cuanto a la desfasada forma de evaluación de los trabajos prácticos en la mira,pos,0.10599999999999998
2022-07-05T18:22:58.000Z,Innovacion Excelente trabajo nos vemos en la Expo,pos,1.1
2022-07-05T13:12:44.000Z,SBC Servicios Basados en el Conocimiento y la Innovación Desde el felicitamos acompañamos y estamos orgullosos de la creatividad de Warani Studios De Paraguay para el mundo exportamos nuestra cultura nuestros mitos y leyendasMala Visión de exportación,pos,1.0
2022-06-22T19:02:12.000Z, La comitiva MICREDIEX recorrió las instalaciones del Instituto de Innovación SENAI en el marco de la misión de promoción económica en las regiones de Santa Catarina y Paraná Brasil ,pos,0.589
2022-06-22T13:10:08.000Z,Luego en horas de la tarde a las horas asistirá a la ceremonia de Apertura del Seminario Internacional de Turismo Rural e Innovación Tecnológica que se desarrollará en el Centro de Convenciones de la #AM,neg,-0.187
2022-06-13T14:56:46.000Z,La Economía del Conocimiento cambio cultural rupturista donde La innovación es continua y de esa forma se quiebra la ley de los rendimientos decrecientes de la industria agropecuaria El hombre deja de ser máquina Todo depende del capital social no jerarquía,pos,1.649
2022-06-06T22:03:59.000Z,El Círculo de Innovación por primera vez en Paraguay #innovation #ISO #innovacionLATAM,pos,0.25
2022-05-17T18:37:09.000Z,Gracias por acompañarnos y mostrar el cumplimiento de los Objetivos de Desarrollo Sostenible la Reducción de las desigualdades la Innovación e Infraestructura y Ciudades y comunidades sostenibles #ODS #ODS #ODS #turismoinclusivo,pos,1.4969999999999999
2022-05-11T02:03:21.000Z,Lean bien mm de lluvias al año innovación tecnología sacrificio Nada que objetar mucho para aprender y admirarles en esta materia,neu,0.04200000000000004
2022-05-04T02:38:12.000Z,Llevamos adelante el curso “Habilidades Gerenciales” dirigido a colaboradores de la empresa 𝐀𝐥𝐞𝐱 𝐒 𝐀 de a horas Los tutores son técnicos del Centro de Innovacion de Metodologia Avanzada del ,pos,0.471
2022-04-28T23:16:22.000Z,Yo lo único que digo Es que la sangre nueva que entra como pasante a la facultad es la que le va dando otra vez realce a las clases Ahora les pido que nos den mas espacio para seguir compartiendo conocimiento e innovación Gracias,pos,1.658
2022-04-12T17:41:40.000Z,La innovación siempre llama la atención y abre caminos,neu,0
2022-04-08T15:03:48.000Z, El informe de “Capital Social” presenta resultados que podrían convertirse en un valioso aporte de innovación social dirigido a comisiones vecinales y otras instancias de participación ciudadana Leé el estudio aquí ,pos,1.13
2022-02-26T13:27:49.000Z,Feliz día En especial para los emprendedores que trabajan en el cluster del Tereré aplicando innovación sostienen nuestra cultura y la adaptan a los nuevos tiempos ,pos,1.78
2022-02-26T01:17:37.000Z,Gracias Angela por la invitación Siempre un gusto compartir espacios para favorecer el ecosistema de Innovación de nuestro país ,pos,0.759
2022-02-23T23:34:50.000Z,Innovación #Olimpia siempre a la vanguardiaLos colores del #Bosque se translada a la ra indumentaria #Juntos,pos,0.35
2022-02-10T13:45:37.000Z,Innovación en productos Canilla Fv ya incluye una cinta teflon para la instalación de la misma Aquellas empresas o marcas que no escuchan a sus clientes están condenadas a la muerte o a ser reemplazadas ORO,pos,0.375
2022-01-29T11:54:31.000Z,Interesante artículo sobre InnovaciónHay una pregunta que cualquier innovador debe tener en mente todo el tiempo Qué futuro quieres tener Y una subpregunta igualmente importante Qué implica eso que estás creando o usando para ese futuro ,pos,1.688
2022-01-22T22:31:59.000Z,La q dice fin de la pobreza hambre saludbienestar educ de calidad igualdad de género agua limpia energía asequible trabajo decente industriainnovación reducción de desigualdades ciudades sostenibles producción responsable acción por el clima pazjusticia etc,pos,1.7169999999999999
2021-12-06T01:43:17.000Z,Contenta por formar parte de la era Red de economía de la Innovación en Py Gracias al y al se vienen grandes proyectos para fortalecer el ecosistema ,pos,0.8919999999999999
2021-12-04T12:27:10.000Z,Unrecibir el reconocimiento por la contribución interinstitucional de Alto Impacto Social a la iniciativa científica en un evento de premiación del Consejo Nacional de Ciencia y Tecnología del Paraguay a Proyectos de Innovación Social en la Temática Salud #SinDejarANadieAtras,pos,0.786
2021-12-03T14:23:01.000Z,Innovación es también estar cerca de uno cuando lo necesites Felicidades a Goods Pan por la apertura de su local en el Shopping Pinedo Muchos éxitos para ustedes ,pos,1.008
2021-12-01T17:25:58.000Z,Trabajo seleccionado para presentación en la Jornada de Innovación Docente UNA en Universidad Nacional de Asunción ,pos,1.1
2021-11-30T15:36:51.000Z,Que esperas para darle innovación y un control sumamente exhaustivo a tu empresa o emprendimientoDesde tu móvil podés acceder de forma instantánea y con resultados exactos de tu NegocioMódulos completos o selecciónados Consultoría Contable actualizado a la Resolución ,pos,2.032
2021-11-29T21:20:00.000Z,Paraguay mejora cada año su posición en el ranking global de innovación demostrando la creciente capacidad de innovación de nuestra economía,pos,0.982
2021-11-09T19:08:51.000Z,Nuestro invitado para la Semana Global del Emprendimiento es el Director de Fomento desarrollo e innovación del MIC nos explicará la importancia de emprender y cómo el emprendedurismo favorece el desarrollo de un paísTransmisión vía ,pos,0.875
2021-11-05T21:17:58.000Z,Seminario de Protocolo Estrategias e Innovación en Eventos,neu,0
2021-11-05T21:13:37.000Z,er Seminario de Protocolo Estrategias e Innovación en Eventos ,neu,0
2021-11-03T20:26:02.000Z,Las clases virtuales se encuentran a cargo de Nathalia González y Estela Riego Galeano profesionales del Centro de Innovación de Metodología Avanzada y Formación a Instructores dependiente del #SINAFOCAL,pos,0.688
2021-11-03T15:05:59.000Z,Las tutorías están a cargo de Lic Ruth Rodríguez Guido Alonso y Gustavo Céspedes profesionales del Centro de Innovación de Metodología Avanzada y Formación a Instructores dependiente del #SINAFOCAL,pos,0.375
2021-11-03T14:48:13.000Z,En la GEW tendremos una invitada especial Romina Da Re Si querés conocer acerca de economía de la innovación y el impacto de las startups en los indicadores económicos de un país súmate a la transmisión el a las hrs A través de ,pos,0.125
2021-11-03T01:24:09.000Z,Predigo que está Innovación llegará al Paraguay en años en el ,neu,0
2021-11-01T15:46:27.000Z,Junto al Presidente de la firmamos un Memorando de Entendimiento con la UIP dando un marco alcompromiso de trabajo conjunto cel sector industrial pimpulsar la sostenibilidad energética y la innovación pel #DesarrolloSostenible#SinDejarANadieAtrás,pos,0.475
2021-10-31T13:33:29.000Z,Abrazo al pueblo Argentino porque tengo una hermosa hija Argentina y se que un día ese vasto país volverá a ser lo que era una referencia en términos económicos e innovación,pos,1.002
2021-10-20T16:49:29.000Z,Innovación de calzada pública y calle en pleno barrio residencial Barrio san Jorge Calle tte Macchio casi juez Enrique pino Local “A cuotitas “,pos,1.376
2021-09-22T16:58:01.000Z,El FEP es gratuito Inscribite en la página y conectate con la innovación en el siguiente link ,neg,-0.281
2021-09-17T18:11:31.000Z,Buscando impulsar la #innovación la protección de la #propiedadintelectual el fortalecimiento del modelo de negocios #Place y#Transferteq firman alianza del acto en la siguiente nota de ,pos,0.304
2021-09-16T00:32:21.000Z,Cuando propones Innovacion y … ,neu,0
2021-09-14T23:21:29.000Z,Si no era por el halo chau Hamilton Tremenda innovación fue la de incluirla como medida de seguridad cuando en su epóca muchos habian estado en contra de su implementación Gran acierto ,pos,0.7130000000000001
2021-09-07T13:04:12.000Z,Los equipos hoy se encuentran trabajando en las propuestas que quedarán para la comunidad fortaleciendo y diversificando la oferta de productos con las técnicas artesanales implementando diseños que garanticen innovación calidad y continuidad en las propuestas,pos,0.975
2021-09-05T15:19:55.000Z,Creatividad desarrollar nuevas ideas Innovación hacer uso de nuevas ideas ,pos,1.125
2021-09-01T20:42:17.000Z,Hasta las hs Date una vuelta por acá Fijate en la innovación aposta por un Servicio de calidad y Nacional ,neg,-0.125
2021-07-14T16:05:25.000Z,Ansiosos Esperando que llegue el evento Si aún no te registraste andá ya a #CPLatam #CP #Tecnología #innovación #Ciencia #Entretenimiento #emprendedurismo ,pos,0.531
2021-07-13T14:48:40.000Z,Animate y sé parte de la innovación Varios países ya empiezan a trabajar con #revitConstruyen virtualmente en D Ven y revisan el edificio en D Construyen virtualmente en base a familias Inscripciones al #ctp #formandoprofesionales,pos,0.44999999999999996
2021-07-12T14:47:05.000Z,Conocé cómo se trabajan los datos de manera innovadora en un gobierno Sé parte de esta revolución digital ¡Registrate en #CPLatam #CP #tecnología #innovación #ciencia #entretenimiento #emprendedurismo ,pos,1.006
2021-07-11T02:44:38.000Z,Ciudad de emprendedores artesanos y artesanas hombres y mujeres libres que nada esperan del Estado x siglos Mucha más prospera que la capital Paraguarí que depende del empleo público Detrás del Caañabé más del de las familias viven de la innovación del sector privado,pos,2.1319999999999997
2021-07-05T14:52:25.000Z,Cada vez más cerca Campus Party Digital Edition ¡Registrate en #CPLatam #CP #tecnología #innovación #ciencia #entretenimiento #emprendedurismo ,pos,0.781
2021-06-30T18:31:31.000Z,Chaco Innova El Primer Desafío de Innovación para el Gran Chaco Americano Destinará hasta USD para identificar e implementar las mejores soluciones de innovación en tecnologías para comunidades Para más info ingresá a ,pos,0.063
2021-06-28T14:59:49.000Z,Campus Party Digital Edition ¡Registrate en #CPLatam #CP #tecnología #innovación #ciencia #entretenimiento #emprendedurismo ,pos,0.531
2021-06-16T15:12:11.000Z,¡Vuelve el evento de innovación más grande de la historia 󰚕Con los principales referentes en las temáticas tecnología ciencia e innovación emprendedurismo entretenimiento y futuro del trabajo ¡Registrate en #CPLatam #CP,pos,1.5620000000000003
2021-06-14T15:29:53.000Z,Participa de un webinar donde podrás conocer sobre las oportunidades en Innovación Abierta con invitadas que nos contarán sus experiencias en emprendimiento tecnológicos de Junio h Participación gratuita vía ZoomINSCRIBITE en ,neg,-0.26
2021-06-11T15:57:00.000Z,La Rectora de la UNA felicitó al nuevo Director Paraguayo de y manifestó el compromiso académico con la innovación científica y tecnológica a través de alianzas,pos,1.663
2021-06-11T15:23:35.000Z,Innovación trazabilidad transparencia y eficiencia en la gestión de políticas públicas ,pos,1.313
2021-05-05T22:40:59.000Z, Ponemos a disposición de las Empresas y de la Ciudadanía una serie de Webinarios de formación profesional llevados adelante por el Centro de Innovación de Metodología Avanzada del Podes armar tus grupos invitando a tus amigos o compañeros y así aprender juntos ,pos,0.35
2021-05-04T01:06:56.000Z,Muy buena la innovación de la toda la transmisión en vivo en modo Marvel,pos,0.9299999999999999
2021-05-03T18:56:32.000Z,ESTO Innovacion “Innovar” no necesariamente es Tecnología no es una app no es una startup nuevas formas para lo conocido ,pos,0.5
2021-05-03T18:07:33.000Z,Diez puntos a su innovación,neu,0
2021-04-29T22:56:46.000Z, Mariela y Cristian son dos compañeros del Son técnicos del Centro de Innovación de Metodología Avanzada quienes están trabajando con los alumnos de la A seguir asi ,pos,0.9919999999999999
2021-04-28T16:40:28.000Z,Apostamos por la #innovación en las #empresas por eso celebramos este paso p la #formalización y el rápido arranque de nuevos #emprendimientos Inscribite segui los pasos y abrir tu #EAS en ,pos,0.318
2021-03-30T22:23:19.000Z, 𝙀𝙣 𝙦𝙪é á𝙧𝙚𝙖𝙨 𝙙𝙚𝙗𝙤 𝙘𝙖𝙥𝙖𝙘𝙞𝙩𝙖𝙧𝙢𝙚Debe ser una pregunta muy frecuente para mejorar tu empleabilidadCon este producto del Centro de Innovación de Metodología Avanzada del te queremos ayudar Responde preguntas ,pos,0.806
2021-03-29T00:14:01.000Z,E INNOVACION Basta las confrontaciones recuerdos tristes y violencia,neg,-0.884
2021-03-28T20:09:54.000Z,Smart Challenge turístico busca innovación en el Camino de los Jesuitas Junto con el Banco Interamericano de Desartollo BID y el apoyo de la Organización Mundial del Turismo Paraguay Argentina Bolivia Brasil y Uruguay lanzaron el Smart Challenge,pos,1.875
2021-03-27T15:36:20.000Z,Webinar Uniendo energías hacia el Paraguay Infraestructura física educación salud e innovación tecnológica p llegar al como el centro energético de la región Con el Econ Jeffrey SachsMiércoles de marzo hs Inscrpciones ,pos,1.9989999999999999
2021-03-25T19:38:49.000Z,Arrancamos el programa de innovación abierta con y ,neg,-0.25
2021-03-24T11:04:56.000Z,El Foro Innovation Days es uno de los principales encuentros de innovación en Estambul ¡Nos llena de orgullo que nos represente y relate el impacto del en distintas partes del mundo ¡De al ,pos,0.139
2021-03-19T17:16:58.000Z,Transformación de la materia prima a través de innovación en tecnología y capacitaciones para mejorar productos derivados de la leche queso helado yogurth otros dirigido a mujeres y jóvenes Con y ,pos,0.281
2021-03-17T14:10:41.000Z,Tener tu propia startup es posible si te rodeas de las personas correctas y trabajas duro para lograrloTe acompañamos durante el proceso de pre incubación de tu idea de negocio basada en alguna tecnología y con componentes de innovaciónIngresá a ,pos,1.9060000000000001
2021-03-16T12:21:45.000Z,El secreto de la innovación educativa es el estudiante activo y el docente tutor Pasamos de la lección a la experiencia educativa,pos,1.8339999999999999
2021-02-25T11:33:36.000Z,Llegó el díaLa Presidenta la Dra Cynthia Villalba junto con la Directora la Lic Rosa González estarán participando como invitadas especiales en éste lanzamiento Éxitos a nuestro socio quién es uno de los líderes de ésta innovación ,pos,1.7280000000000002
2021-02-25T03:09:09.000Z,Cómo pasó Estonia de ser un país pobre a una potencia en tecnología e innovación vía ,neu,-0.04199999999999998
2021-02-24T15:27:39.000Z,Invitación abierta Nuestros socios el Dr Mauricio Cáceres y el Dr Renzo Destefano estarán presentando interesantes proyectos de innovación Les esperamos ,pos,0.31299999999999994
2021-02-21T04:42:20.000Z,La Asociación de Mujeres ARAPOTY recibió una cosechadora de forraje a precisión una herramienta para aumentar la producción de alimentos para el ganado vacuno El Componente Mujeres Jóvenes impulsa la innovación de tecnología con el apoyo de ,pos,1.1059999999999999
2021-02-19T21:41:15.000Z,Lanzamiento Digital delManual de Residentes de Cirugía General el primer libro totalmente digital de la FCM UNA El Dr Renzo Destefano miembro de ésta sociedad es uno de los protagonistas de esta innovación #Saluddigital #eHealth,pos,0.25
2021-02-11T23:00:39.000Z,“Innovación y desarrollo digital para brindar mayores beneficios a los socios” #somoscit #SomosNaranja,pos,0.375
2021-01-19T12:25:04.000Z,El año pasado fue un año de grandes desafíos de grandes cambios estábamos en el medio de decidir cuáles eran los desafíos nacionales de innovación a quienes íbamos a enfocar,neu,0.008999999999999897
2021-01-14T17:55:08.000Z,Grande Paraguay En enero la importacion de covid desde Brasil incremento en tiempo record Paraguay a la vanguardia e innovacion con la nueva cepa En tu cara resto del mundo,pos,0.292
2021-01-11T21:52:57.000Z,Hermoso está amix Lástima que contrataron a un grupo de herreros con mal de parkinson Nivelaron la obra con plastilina Eso sería genial seríamos pioneros en innovación ,pos,0.07800000000000007
2021-01-01T03:21:08.000Z,¡Feliz Por un nuevo año con mejoras significativas en la Educación asi como en el Sistema Nacional de Ciencia Tecnologia e Innovación,pos,0.41700000000000004
2020-12-17T14:32:17.000Z, Hoy como ponente en las XI Jornadas de Innovación Docente de la Universidad Nacional de Asunción Edición Virtual presentando nuestra experiencia en la implementación de la #Telepsiquiatría ,pos,0.8959999999999999
2020-12-09T21:18:06.000Z,Red Somos Innovación Nuevo Estudio de Opinión Muestra que los Latinoamericanos Quieren Más Innovación Business Wire ,neu,0
2020-12-09T05:14:54.000Z,Televisa viene repitiendo Hasta veces las mismas historias con cambio de nombre #ImperioDeMentiras es una innovación a lo que vemos siempre,pos,0.6
2020-12-04T22:19:10.000Z,Premio a la Innovación Felicitaciones Gracias ,pos,1.267
2020-11-15T13:40:21.000Z,El celular es una innovación tecnológica muy importante el uso que le des es lo que cuenta El celular no te cambia las prioridades y los valores de la gente es la que cambia,pos,0.313
2020-11-04T18:00:07.000Z,Sabían esto Una VER GUEN ZA Para el despilfarro están pedís transformación o innovación en salud educación bancas y se cruzan de brazos,pos,1.0
2020-11-04T17:55:19.000Z,#ItalianDesignDay # IDD “Dibujando el futuro Desarrollo innovación sostenibilidad belleza El diseño del futuro será colectivo y partirá de nuevo del hombre y sus necesidades reales dice Silvia Robertazzi cofundadora del #MilanoDesignFilmFestival,pos,0.313
2020-10-26T01:28:35.000Z,Los cambios traen innovación y la innovación lleva al progreso,pos,0.6
