postDates,tweets,sentiment_label,polarity_score
2018-08-22T23:20:43.000Z,Elkem fabrica ferrosilicio de alta calidad Se usa como insumo para la producción de acero y de aluminio Elkem apunta además a ser líder en innovación en el uso y la producción sostenible de biomasa ,pos,1.1629999999999998
2018-08-22T18:51:03.000Z,LG Electronics lanza su nueva Campaña Sumate al Mundo Premium Asunción Paraguay de agosto de LG Electronics en su constante búsqueda por la innovación y la tecnología… ,pos,0.694
2018-08-22T18:49:22.000Z,LG Electronics lanza su nueva Campaña Sumate al Mundo Premium Asunción Paraguay de agosto de LG Electronics en su constante búsqueda por la innovación y la tecnología… ,pos,0.694
2018-08-19T01:27:54.000Z,Curso de innovación y marketing deportivo punta pie inicial para los objetivos próximos Agradecido con el profesor por las enseñanzas y la calidad humana también a mis compañeros que también aprendí mucho de ellos ,pos,1.313
2018-08-01T22:00:40.000Z,Listos para comenzar la segunda parte del Foro Internacional de Investigación e Innovación en UPAP con #HacemosCiencia,pos,0.387
2018-08-01T21:20:35.000Z,Muy interesante la conversación con Patricia tenemos que incentivar y premiar la innovación en el Paraguay es el futuro de la economía,pos,1.563
2018-07-30T16:34:54.000Z,Vine a darle mi batón ahq Mongarú Estudio De Innovación in Asuncion w ,pos,0.25
2018-07-29T22:15:24.000Z,Innovacion Nuevas Formas para lo Conocido ,pos,0.5
2018-07-25T13:00:31.000Z,Cuáles son las necesidades en tecnología e innovación de los centros educativos vía el Paraguay debemos optar por estos modelos Es posible,pos,0.813
2018-07-25T12:58:49.000Z,Te ofrecemos fortalecer tus capacidades en Oratoria y Argumentación con Innovación y Gestión con Actualización en Derecho Constitucional con Actualización en Derechos Humanos y Anticorrupcion ,pos,1.557
2018-07-23T14:44:41.000Z,Felicitamos a todos los ingenieros en su día y les agradecemos por su labor comprometida con la innovación con el mejoramiento de la sociedad y con el desarrollo de nuevos conocimientos,pos,0.625
2018-07-11T00:04:33.000Z,El CONACYT lleva a cabo “La Noche de la Innovación” Presentación oficial de #PROINNOVA ,neu,0
2018-07-10T23:34:45.000Z,#Innovacion #ExpoMRA Asociacion Rural del Paraguay in Mariano Roque Alonso Paraguay ,pos,0.25
2018-07-10T00:26:40.000Z,Mis alumnos de Innovación Empresarial en pleno trabajo de análisis en Posgrado Universidad Columbia ,pos,0.788
2018-07-02T23:58:45.000Z,Algún problema de negocio que no se resuelve con comunicación Innovación Una gran oportunidad #Marcas #apuntesalpaso,pos,0.15100000000000002
2018-06-29T18:11:24.000Z,#Innovación #YerbaMate Les presento los Mate Greenies Brownies con con Yerba Mate,neu,0
2018-06-26T17:17:05.000Z,Hoy en ProNoticias de nuestra directora de Patrimonios Turísticos Gabriela Rolandi estuvo comentando todo acerca de lo que fue la inauguración del #MappingD en la Misión de Jesús de Tavarangué y lo que significa para el turismo nacional y regional esta innovación,pos,0.75
2018-06-10T23:28:19.000Z,Felicitaciones a los amigos de la vereda de enfrente por copiar lo bueno la innovacion que vino desde hace que el futbol pyo eleve el nivel Claramente marcamos tendencia y eso nos dice que estamos en el camino correcto A seguir laburando #MKTCCP,pos,1.323
2018-06-06T23:33:51.000Z,Diseño e Innovación en la economía naranja Union Industrial Paraguaya in Asuncion ,pos,0.625
2018-05-24T23:58:58.000Z,Las “ i” p el #CrecimientoEconómoco a largo plazo Inversiones Instituciones Integración Innovación Inclusión Presentación de Presidente del en el #BCPEduca #DíaDelEconomista,pos,0.3
2018-05-22T23:47:40.000Z, financia el proyecto Innovación para el Cambio Climático implementado por la fundación FES y ,pos,0.95
2018-05-21T18:06:45.000Z,¡Gracias por compartir el evento #Cerrito Queremos posicionar a Paraguay como referente de innovación y tecnología en eliminación de pobreza #EndPoverty,neu,0
2018-05-21T17:45:42.000Z,Muchas gracias a la FCE de la UNA por la invitación para compartir esta mañana con la comunidad universitaria para hablar sobre Innovación y Emprendimiento en el Paraguay ,pos,0.35
2018-05-21T15:48:33.000Z,#Cerrito ¡Más reconocimientos Esta vez fue declarado de interés Municipal por parte de la Junta Municipal e Intendencia de Benjamín Aceval ¡Nos sentimos felices por recibir a líderes en innovación y tecnología para la eliminación de pobreza,pos,2.057
2018-05-19T15:04:53.000Z,Buscamos que la gente que vaya a #GramoFestFiis encuentre espacios de aprendizaje diversión innovación y que pueda participar de estos cambios dinámicos que aportan a la sociedad de ,pos,0.30299999999999994
2018-04-13T14:32:34.000Z,Excelente representación cuota Colombiana en el departamento de innovación ,pos,0.75
2018-04-13T10:41:11.000Z,Im at CEFIPPCentro De Formación e Innovación en Políticas Públicas ,pos,0.438
2018-04-12T21:08:46.000Z,Cerrito es un encuentro internacional que reunirá líderes en innovación social y tecnología a fin de crear soluciones para la eliminación de pobreza en sus distintas dimensiones Más información en #Cerrito #EndPoverty,pos,0.368
2018-04-11T15:35:33.000Z,Aprovecha esta nueva innovación genial iniciativa de el Club Olimpia para adquirir tus entradas En cualquiera de los cajeros de Vision Banco ¡Comprás Imprimís e Ingresás,pos,1.078
2018-04-07T16:35:43.000Z,“ La competitividad la innovación el uso de las herramientas digitales son clave para diseñar un turismo hecho por jóvenes y para los jóvenes” dijo la ministra al finalizar su ponencia en el tercer Foro de Turismo Joven con enfoque en la “Transformación Digital del Turismo”,neg,-0.062
2018-04-06T20:39:01.000Z,Firmamos convenio con para implementar el Semáforo de Eliminación de Pobreza con el apoyo de Iniciativa de Innovación Social que busca mejorar la calidad de vida de todos los colaboradores de la empresa #ParaguaySinPobreza #SentíQueSePuede,pos,2.024
2018-03-15T12:36:49.000Z,Hoy y mañana se realiza el evento digital más importante del donde junto a grandes colegas como y estaremos disertando sobre tendencias e innovación ¡Alegría,pos,0.667
2018-03-05T11:49:02.000Z,#organizacionesexponenciales #innovacion #disrupcion,neu,0
2018-03-01T19:32:49.000Z,Astillero presenta última innovación en Drones capaces de inspeccionar tanques en espacios confinados ,pos,0.634
2018-02-24T13:37:52.000Z,Reconocemos a la mujer como motor de innovación y transformación en el pasado presente y futuro de Paraguay Las mujeres abriendo nuevos horizontes para el país desde siempre ¡Feliz Día,pos,0.25
2018-02-23T18:49:45.000Z,Mientras nosotros vivimos en el este Kepi vive en el correlí #HAGAMOS es innovación,neu,0
2018-02-21T19:57:10.000Z,Este es el desafío de fondo Y la razón por la cual la innovación tiene que estar al centro de la agenda de futuro de nuestros países,neg,-0.275
2018-02-20T22:46:45.000Z,Hace año y mediante este apoyo y el enfoque Multidisciplinario HIPEC PY en la vanguardia de la innovación terapéutica,pos,0.663
2018-02-20T12:35:00.000Z,Tratar de imponerse por el miedo por el ejercicio de la fuerza sin propuestas sin intenciones de cambio y mejora representa la muestra clara de un modelo que se está agotando y que no podrá sobrevivir ante la innovación #uberparaguay,pos,0.052999999999999936
2018-02-19T13:47:57.000Z, necesitamos innovación urgente vine a la peluquería con mis audífonos y solo escuché el final de una de las tantas discusiones interesantes con el resto publicidad Me vine a escuchar tanda,pos,0.18799999999999994
2018-02-21T19:57:10.000Z,Este es el desafío de fondo Y la razón por la cual la innovación tiene que estar al centro de la agenda de futuro de nuestros países,neg,-0.275
2018-02-20T22:46:45.000Z,Hace año y mediante este apoyo y el enfoque Multidisciplinario HIPEC PY en la vanguardia de la innovación terapéutica,pos,0.663
2018-02-20T12:35:00.000Z,Tratar de imponerse por el miedo por el ejercicio de la fuerza sin propuestas sin intenciones de cambio y mejora representa la muestra clara de un modelo que se está agotando y que no podrá sobrevivir ante la innovación #uberparaguay,pos,0.052999999999999936
2018-02-19T13:47:57.000Z, necesitamos innovación urgente vine a la peluquería con mis audífonos y solo escuché el final de una de las tantas discusiones interesantes con el resto publicidad Me vine a escuchar tanda,pos,0.18799999999999994
2018-02-07T18:53:52.000Z,Suscribite a nuestro canal de YouTube para ver videos de historias de superación de emprendedores charlas que te inspirarán y contenido sobre innovación social para eliminar pobreza ,pos,0.393
2018-02-05T00:18:11.000Z,El cobranding tocando las puertas del Superbowl Colaboración como innovación ,neu,0
2018-02-01T11:16:18.000Z,Podriamos aplicar la misma tecnica para meterle la innovación a algunos que cerrada es cierta gente Su rechazo a lo que desconocen es innato al parecer,neg,-1.01
2018-01-30T22:45:13.000Z,Hoy inscribimos nuestra candidatura al Senado Queremos ampliar a nivel nacional todo lo que venimos haciendo transparencia más tecnología más innovación en la gestión pública Muchas gracias a todos los que nos acompañan siempre #HAGAMOSPY,pos,1.5379999999999998
2018-01-30T16:55:02.000Z,Sorpresa Aquí el ranking de los países que producen la mayor innovación ,neu,0
2018-01-24T01:28:15.000Z,Dirigido a la innovación y a los emprendimientos para creación de empleos y startups empresas tecnológicas con capital de riesgo ,pos,0.5940000000000001
2018-01-23T20:05:50.000Z,Dejate de joder como el tereré va a ser una innovacion Si el tereré que es una bebida tradicional del Paraguay siempre se consumió frío y en sus variedades con yuyos o cítricos como la lima o el limón Es mejor informarse bien antes que sacar una exageracion como ésta,pos,0.485
2018-01-21T22:57:19.000Z,Tierra de innovación – Por Benjamín Netanyahu ,neu,0
2018-01-18T18:15:49.000Z,También de innovación de cooperación para el fortalecimiento de la investigación científica y en materia de becas y la colaboración entre las Agencias Espaciales de ambos países para la utilización del espacio ultraterrestre con fines pacíficos,pos,1.2810000000000001
2018-01-18T18:09:51.000Z, es el #uber de las ticketeras usenlo #etickets #innovacion #sinPapel #sinFilas,neu,0
2018-01-15T09:47:38.000Z,Ayer me comunique con un copi de Slovakia apenas le consulte si conocia ya me dice que si pero nunca lo probó porque el es de la “vieja escuela” la negacion es la primera respuesta hacia la innovación ,neg,-0.937
2018-01-10T21:03:56.000Z,Invitan a enviar trabajos de investigación en el ámbito de la economía de la innovación y el emprendimiento para la “ª Conferencia de la Red Latinoamericana de Economía de la Innovación y el Emprendimiento”,pos,0.35
2018-01-10T21:01:57.000Z,ª Conferencia de la Red Latinoamericana de Economía de la Innovación y el Emprendimiento,neu,0
2018-01-05T22:40:05.000Z,Israel establece el primer laboratorio de innovación para impulsar la tecnología para ayudar a los adultos mayores ,pos,0.65
2018-01-03T20:13:18.000Z,Realizamos un brindis con las organizaciones que conforman la Red de Empresas del Semáforo que aplican el programa Empresas sin pobreza con apoyo de y en alianza con la Iniciativa de Innovación Social ¡Celebramos un año con muchos logros alcanzados,pos,0.7429999999999999
