postDates,tweets,sentiment_label,polarity_score
2020-10-21T17:55:28.000Z,Hoy presentamos el Sello de Genero Público del en el foro “Resiliencia e Innovación en la Formación Judicial”Estamos implementando el Sello Público con #sindejaranadieatrás #ODS #ODS,pos,1.126
2020-10-18T15:07:17.000Z,Orgullo Paraguayo #innovacion ,neu,0
2020-09-19T12:41:12.000Z,La historia de la educación de Paraguay conoce a Sacerdotes que han hecho muchísimo por el sistema el Dr Francia impulsó un programa de inversióndesarrollo que generó innovación y creatividad Don C A López elevó el nivel al mejor de todo América xq no lo hacemos hoy ,pos,1.438
2020-09-15T03:17:13.000Z,a la ingeniería transporte ciencia tecnología innovación Este grupo es de WhatsApp usted se une con el enlace y debe silenciarlo pues muy temprano los administradores envían las tapas de diario y si usted tiene silenciado el grupo,pos,0.313
2020-09-08T03:23:37.000Z, CIMEFOR Transmisiones Cámara paraguaya de la Industria Cerámica CATERPPA Cámara Nacional de Comercio y Servicios del Paraguay Centro de Propietarios de Panadería y Fideerías del Paraguay Camara Paraguaya de Diseño e Innovación,pos,0.375
2020-08-24T22:57:16.000Z, ¡La campaña #ParaguayoComoVos está en marcha Productos hechos en nuestra tierra con orgullo innovación y mano de obra nacional estarán expuestos con destaque especial en góndolas de supermercados asociados a la Capasu¡Sumate a esta iniciativa ,pos,0.411
2020-08-23T16:03:17.000Z,Aquella innovación,neu,0
2020-08-19T19:17:33.000Z,Webinar StartupsEmprendiendo con Innovación en Latinoamérica para conocer más acerca de esta organización de Inversiones y laboratorios para emprendimientos innovadores Miércoles h Fb Live Estrategia de Innovación Py ¡No te lo pierdas,pos,0.10999999999999999
2020-07-29T04:42:02.000Z,Innovación de sistema desmontable mConsorcio ContecBloques de OficinasDormitoriosLaboratorio,pos,0.5
2020-07-27T19:27:44.000Z,La innovación es víctima de la burocracia Ante urgencia el DINAVISA u otra debe tomar riendas y emitir resolución transitoria Mientras y conscientes de los tiempos trabajaremos proyecto de ley para un espacio controlado de pruebas “sandbox” regulatorio,pos,0.35
2020-07-27T14:34:39.000Z,La mayoría de las personas tienen miedo de cometer errores pero en realidad EL error es no querer cometerlos la innovación y la creatividad no pueden ser alcanzadas sin cometer errores enfrentar obstáculos y contratiempos #japokatu,neu,-0.04999999999999999
2020-07-27T13:03:59.000Z,CU y SAE Consultora te ofrecen beneficios Máster en Desarrollo Emprendedor e Innovación Paraguay por la Universidad de Salamanca Online Advanced ProgramsFinanciado a través de Créditos de la CU Más info al correo consultora com py,pos,1.125
2020-07-25T14:48:33.000Z,Exquisito desayuno a base de yerba mate se pasóGracias a por el detalle potenciando la innovación y competitividad en los productos de nuestros #emprendedores,pos,0.75
2020-07-11T02:06:29.000Z,Orgullosa de pertenecer a la con este convenio se lograrán muchos avances en investigación capacitación e innovación,pos,0.25
2020-07-07T20:29:14.000Z, Invitamos a participar del Webinar “Emprendimiento e Innovación desde la Ciencia y la Tecnología”Dirigido a investigadores emprendedores y organizaciones Jueves de julio a las horas Inscripciones ,pos,0.125
2020-07-03T23:15:36.000Z,Bien Hay que darle la bienvenida a la innovación tomarla como desafío No pincharse y protestar porque a vos no se te ocurrió Mal Red Bull bien Mercedes,pos,1.684
2020-06-27T16:43:05.000Z, Preparan reactivación turística de mano de la innovación la tecnología y la creatividad Compartimos y Agradecemos la nota de ,pos,1.125
2020-06-22T20:24:08.000Z,Simplemente Impresionante Vieron todo lo que esta haciendo un Joven Presidente con innovación sencibilidad social Poniendo en primer lugar LOS INTERESES DEL PUEBLO y no su bolsillo Todo esto… ,pos,0.976
2020-06-19T20:56:40.000Z,La radio a pila siempre va a ser mejor que cualquier innovación tecnológica pero ustedes no están preparados para este debate,pos,0.29799999999999993
2020-06-18T00:37:27.000Z,Final de innovación de lujo felicidades a los finalistas y al equipo ,pos,0.989
2020-06-12T16:49:41.000Z,La innovación en las corridas llega a nuestro país a través de Corrida Olímpica Virtual organizada por el con apoyo de la #SND la misma se realizará el próximo de junio Mas detalles en ,pos,0.913
2020-06-11T21:19:09.000Z,En un país donde el emprendimiento y la innovación están en su mejor momento se hace oportuno trabajar iniciativas públicas que presenten soluciones a esta realidad y antes que condenarlos a la informalidad los acerquen a los estamentos públicos por medio de apoyos efectivos,pos,2.118
2020-06-10T16:46:11.000Z,Reunión con el Mtro del el Pdte de Ing Juan Duarte con el Telecentros a gobiernos Departamentales buscando fomentar desarrollo y bienestar a las comunidades mediante la TIC creando oportunidades e innovación,pos,0.812
2020-05-20T01:18:22.000Z,La innovación será clave en la reactivación del turismoCompartimos y agradecemos nota de ,neu,0
2020-05-20T00:04:08.000Z,Pasaron DÍAS desde que se aprobó la Ley de Emergencia Cuesta seguir hablando de medidas “de auxilio” Los préstamos ya no llegaron Toca mirar para adelante Ver oportunidad en la innovación vías alternativas y tecnologías que masifiquen formalización e inclusión financiera,pos,1.475
2020-05-19T16:12:20.000Z,En estos tiempos de innovación también estamos en la web Habilitamos nuestra tienda online lo relacionado a la seguridad electrónica CCTV redes automatización de portones #SOMOSAG,pos,0.583
2020-05-18T17:06:36.000Z, WEB La innovación será clave en la reactivación del #Turismo Info ,neu,0
2020-05-18T15:07:28.000Z,La innovación es tendencia en la industria del #Turismo Hoy personas asistieron a nuestro #Webinar con experta en innovación digital de la Organización Mundial del Turismo Sin duda la #tecnología ha llegado para quedarse ante los nuevos desafíos,pos,0.625
2020-05-18T14:20:40.000Z,#Ahora inicia el #Webinar en Innovación Turística a cargo de asesora de transformación digital de la #OMT El encuentro online es llevado adelante conjuntamente por la y la y cuenta con la participación de la ministra ,pos,0.875
2020-04-27T19:32:33.000Z,Nuestra prioridad es tener #INFORMACIÓN OPORTUNA Y DE CALIDAD para medir el impacto #COVID al querido mediante la #INNOVACIÓN en la #EPHC con respaldo del #MejoresDatosMejoresVidas #QuedateEnCasa,pos,1.4420000000000002
2020-04-27T17:56:05.000Z, #INNOVACIÓN Gracias al apoyo de para contar con Información oficial sobre como estamos en #Paraguay,pos,1.075
2020-04-27T17:07:10.000Z,El colabora con la apoyando a la #innovación en la Encuesta Permanente de Hogares para continuar recabando información imprescindible para la toma de decisiones y hacer frente al impacto del #COVIDCooperamos para #ReconstruirMejor#BuildBackBetter,pos,0.5
2020-04-27T04:46:43.000Z,Y si ya llegarán emprendimientos que les hagan salir de su zona de confort #innovación #nuevomodelo,pos,0.5
2020-04-25T23:02:31.000Z, el “and ” claramente es una innovación de este siglo En la del siglo XX te daban el foul pero nunca el doble,neg,-0.25
2020-04-25T13:59:50.000Z, Conferencia en la Universidad de Gaaguazú Paraguay #educacionvirtual #education #paraguay #innovation #tecnologiaeducativa #innovacion #elearning #virtual #disruption #digital… ,pos,0.313
2020-03-29T15:57:33.000Z,Tecnología innovación solidaridad al servicio de la Humanidad,neu,0
2020-03-26T15:22:27.000Z,Puma King Platinum Lazer Touch Hecha un mejor vistazo a la nueva innovación de pumafootball Consultas al Envios en todos el pais por Delivery en Coronel Oviedo ,pos,0.25
2020-03-26T14:34:20.000Z,pumafootball presenta la innovación especial patentada para renovar un ícono y lanza la edición especial King Platinum Lazer Touch Queve una nueva tecnología especial utilizada por primera vez en Kleather para… ,pos,1.1079999999999999
2020-03-22T21:24:12.000Z,Sí el COVID impulsará la próxima gran ola de innovación ,pos,0.08800000000000002
2020-03-22T17:01:16.000Z,#citroencv ejemplo de innovación en los años El #cv es un coche que comienza a producirse por #Citroen justo después del fin de la #segundaguerramundial en Honorable Camara de Diputados ,pos,0.883
2020-03-14T23:07:31.000Z,Es un gran momento para que los medios de comunicación inviertan en innovación y tecnología Exponen a los noteros camarógrafos y técnicos #coronavirus #COVIDー,neg,-0.056999999999999995
2020-03-06T20:04:19.000Z,Materias que deberían enseñar en la escuela Nutrición Inteligencia Emocional Creatividad e innovación Convivencia y Valores Oratoria Ventas Meditación Finanzas Que más podría ser,pos,1.483
2020-03-06T18:39:30.000Z,¡Sumate pues a este gran proyecto de innovación para el ,pos,0.338
2020-02-18T15:09:31.000Z,El proyecto JICA SNPP apunta a mostrar experiencias sobre gestión de calidad en empresas e ennovacion en el rubro de Manufactura El seminario contará con los expertos Tamon Nagai que hablará del TPS y Sabrina Levinton del SENAI que tratará sobre Innovación #ÑambaapoPy,pos,1.083
2020-02-16T22:57:14.000Z,Velador sublimado personalizado y temática corte personalizable con el diseño que desee Aplique de yute foco led a pila y base de hilo poyvi #reciclaje #reciclajecreativo #reciclarte #veladores #innovacion #tecnologia Pedidos al WhatsApp ,pos,0.5
2020-02-07T02:01:26.000Z,La innovación que necesitaba el Futsal llega con NIKE REACT GATO •Nace una nueva especie•Ya disponible por pedido Envíos en todo el pais en Coronel Oviedo ,pos,0.917
2020-02-07T01:59:05.000Z,La innovación que necesita en Futsal llega con NIKE REACT GATO •Nace una nueva especie•Ya disponible por pedido Envíos en todo el pais en Coronel Oviedo ,pos,0.917
2020-02-05T16:19:56.000Z,Hoy nos reunimos con y Juan Coronel para dialogar sobre agenda de cooperación con para PPT del #Paraguay Tecnología e innovación en #salud y #fronteras fueron los temas principales Movilidad de pacientes en #MERCOSUR con apoyo de ,pos,1.6139999999999999
2020-01-05T19:09:47.000Z,Felicitaciones a Merecido reconocimiento a su Gestión Nacional en Innovación,pos,0.417
2020-01-03T11:03:13.000Z,Paraguayos conquistando el a través de la #innovación Orquesta de Cateura un orgullo nacional Sin duda una de las mayores innovaciones sociales made in #InnovaPy #ENIpy ,neu,0.018000000000000016
2020-01-03T02:06:47.000Z,Para registrar tu empresa en el #MTESS podes usar la web oficial La distancia y el tiempo para los trámites administrativos ya no son obstáculos para la formalización del empleo #innovación #Tecnologia #Eficiencia,pos,0.625
2019-12-31T17:52:14.000Z,¡Se cierra un gran año donde construimos grandes oportunidades para innovar Se viene el donde estas oportunidades serán la base para establecer las áreas de nuestros retos nacionales de innovación ¡Salud ,neg,-0.37
2019-12-29T15:46:20.000Z, excelente innovación es el paso hacia el futuro,pos,0.75
2019-12-19T12:56:29.000Z,¡Llegamos al Chaco Este viernes tendremos un taller en #PresidenteHayes Queremos seguir identificando desafíos y oportunidades de #innovación ¡Te esperamos #ENIpy,neg,-0.30000000000000004
2019-12-19T01:26:37.000Z,COI Center Of Innovation es un espacio de Innovación creado Gracias al trabajo del la y la cooperación Coreana el COI es también un Pez que en una pecera es muy pequeño pero al darle espacio suficiente CRECE Un espacio de CRECIMIENTO,pos,0.1379999999999999
2019-12-18T23:47:16.000Z,Este logro va de la mano con la gran apuesta del a través del desarrollo de una nueva plataforma de reservas que podrán implementarlo en los establecimientos extra hoteleros Seguiremos apostando a la innovación en el sector turístico ,pos,1.4380000000000002
2019-12-18T20:42:51.000Z,Hoy en presencia del Canciller rendimos cuentas de lo realizado en el año y renovamos nuestro compromiso para seguir impulsando la localización de la Agenda con pasión e innovación Gracias gracias es un placer recorrer este camino juntos,pos,1.6789999999999998
2019-12-18T19:30:58.000Z,Quiénes son los responsables de llevar adelante Te presentamos al Equipo Impulsor líderes de distintos sectores que fueron seleccionados luego de un proceso abierto por sus logros en #innovación #tecnología y #ciencia ¡Conócelos,pos,0.631
2019-12-17T23:43:15.000Z,El diseño gráfico ha experimentado un cambio hoy no es solamente quiero un logotipo Es desarrollar todos los materiales impresos y digitales capacitarse constantemente trabajando en equipo Buscando oportunidades de innovación,pos,1.2309999999999999
2019-12-04T16:36:09.000Z,Programa General de Compradores Programa Salón de Inversionistas Seminario Encadenamiento Taller Innovación ,pos,0.25
2019-12-04T14:10:30.000Z,Para la Unión Europea y Paraguay la educación es una prioridad compartida Hoy se realizó la Conferencia “Innovación y nuevas tendencias en aprendizajes para una educación de calidad” una gran iniciativa del con apoyo de la y la UE,pos,1.6880000000000002
2019-12-04T11:43:13.000Z,Inicia la Conferencia Internacional Innovación y nuevas tendencias en aprendizajes para una Educación de Calidad En la Sede del Instituto del Banco Central del Paraguay,pos,0.75
2019-12-04T03:48:12.000Z,Parar un proceso que nos ubicó en los primeros lugares en la innovación de la JUSTICIA a pesar de nuestra oscura historia política es simplemente necio Por donde lo mires,neg,-1.012
2019-12-04T02:49:34.000Z, #RealidadAumentada al recorrer #misiones jesuíticas Tejedoras de #Yataity bordando prendas de moda Espacios de #coworking para sector audiovisual Proyectos muy inspiradores“Diplomado #Innovación y #EconomíaCreativa” #FundaciónCIRD ,pos,0.625
2019-12-03T14:14:39.000Z,La educación media técnica con formación de calidad innovación investigación e inserción laboral efectiva de los jóvenes es el eje de estos centros #ñambaapooñondive,pos,0.792
2019-12-02T19:59:12.000Z,Hoy toca a líderes del sector público participar del taller de #innovación Estamos identificando desafíos y oportunidades que afrontaremos Estrategia Nacional de Innovación ¡Con ganas de escuchar tu aporte y construir JUNTOS #ENIpy #InnovaPy ,pos,0.45699999999999996
2019-11-30T17:39:00.000Z,Estamos viviendo una gran fiesta La liga Nacional de Robótica con Más de personas en una jornada cargada de tecnología e Innovación Te mostramos algunos de los equipos en acción,pos,1.088
2019-11-30T15:15:23.000Z,#ahora Nuestros alumnos del curso de Robótica se encuentran en plena competencia en el desafío de la Liga Nacional de Robótica buscando un lugar para competir en el Vez Robotics World Championship en EE UU Súmate a la fiesta de tecnología e innovación #paraguaydelagente,pos,0.882
2019-11-30T13:56:49.000Z, concursantes muestran hoy los proyectos más novedosos buscando un lugar en la final el próximo año en el Vez Robotics World Championship en EEUU Veni pues Esto es una gran fiesta de tecnología e innovación Te esperamos estamos hasta las horas,pos,0.5880000000000001
2019-11-25T10:36:44.000Z,Hoy es un gran día para los docentes directivos y profesionales de #Paraguay que recibirán el certificado final del Diplomado de Especialización en Gestión e Innovación Directiva El grupo viajó durante dos meses a Chile gracias a y ,pos,1.376
2019-11-23T18:38:03.000Z,Cuando el trabajo tiene todo el sentido A seguir dibujando sonrisas #nextgenundp #innovacion #odsagualimpiaysaneamiento #somospnud,pos,1.9500000000000002
2019-11-22T23:03:44.000Z,IV ENCUENTRO NACIONAL DE EMPRENDEDORES COOPERATIVOS Andrés SilvaLiderazgo para la innovación#Jóvenes #Emprendedores #SocioCU #Paraguay ,pos,0.875
2019-11-22T14:32:26.000Z,Participando en el segundo día de la X Jornada de Innovación Docente de la UNA en Universidad Nacional de Asunción ,pos,0.25
2019-11-20T14:17:17.000Z,Queremos que la innovación tenga un desarrollo sostenible en Paraguay basándonos en mejorar la calidad de vida de la gente Los pilares son innovación social empresarial y transparencia en la gestión pública #Digitrends #SomosDigitales ,pos,2.05
2019-11-13T23:29:54.000Z,VIII Foro Internacional de investigadores se llevará a cabo del al de Noviembre En dicho evento estaré participando en carácter de Ponente con la presentación de la Proyecto de Innovación Educativa “PROEDUCA”,pos,1.188
2019-11-13T18:01:19.000Z,Con la firma del nuevo proyecto sumamos nuevos objetivos a incorporar Innovación Igualdad Inclusión Sapea es un programa de formación en educación para el desarrollo y capacitación para el empleo para adolescentes y jóvenes,pos,0.188
2019-11-13T13:21:04.000Z,#innovación un tema fascinante y actual más todavía tratándose de #carreteras y #transporte #HablemosDeCarreteras aquí lo tenemos a Director Tecnico de en esta #JornadaCV ,neg,-0.45799999999999996
2019-11-11T17:41:38.000Z,La revolución educativa está presente en la #ExpoInnovación mediante que se dedica a capacitar a instructores en materia de Innovación Tecnológica STEM Más info al ,pos,1.5639999999999998
2019-11-11T16:19:41.000Z,#Prodi Cámara Paraguaya de Diseño e Innovación Diseño Ganador #MarceloLeguizamon Centro Tecnológico de Avanzada #CTA #Innovación #Tecnología #TecInnovaPy,pos,0.938
2019-11-11T12:06:54.000Z,La ministra de Trabajo brindó sus palabras de apertura de la #ExpoInnovación Queremos revolucionar la educación introduciendo innovación y tecnología,pos,0.35
2019-11-07T13:16:22.000Z,¡Vení vos también para celebrar juntos el Día Nacional del Emprendedurismo con la #ExpoInnovación Nuestro albergará un evento que pretende sentar un precedente en materia de tecnología e innovación,neg,-0.712
2019-11-07T13:16:19.000Z,¡Mediante nuestro Sistema IDENTIDAD llegamos a miles de jóvenes paraguayos para seguir fortaleciendo su formaciónHoy enviamos a nuestros alumnos egresados y participantes inscriptos en el Sistema IDENTIDAD del la invitación a nuestra Expo Innovación,pos,0.725
2019-11-05T21:23:59.000Z,TU PASAJE Y BUENO ESPERAMOS¡¡POR FAVOR NO METRO BUS NO VIADUCTOS TRUCHOS QUE SE AGRIETARON Y MÁS CURIOSO ES EL QUE SE HINUNDA ESA ES UNA SUPER INNOVACION¡¡SUPER INNOVACIÓN,pos,1.0
2019-11-04T20:09:52.000Z,En el Día Nacional del Emprendedurismo tendremos la #ExpoInnovación mostrando todo el talento paraguayo en Innovación y Tecnología Si tu emprendimiento tiene que ver con mecanización no podés faltar ¡Vení este de noviembre ,pos,0.708
2019-11-04T15:33:17.000Z,Hoy soñé que te encontré en el Biggie cerca de mi casa estabas en la fila de la caja y le llamaste la atención a la cajera yo estaba detrás te dije que todo se consigue con paciencia y esperamos Unión Construccion Innovación Evolución ᭄ ᭢ ᭄ ᭢,pos,0.25
2019-10-28T19:50:52.000Z,Hoy Ministro del junto con nuestro Secretario General Adjunto Director Regional inauguraron nuestra Reunión de los Representantes del Liderando Innovación para el desarrollo sostenible en ALC #Agenda #NextGenUNDP,pos,1.438
2019-10-28T18:31:22.000Z, nos acompaña esta semana intercambiando experiencias de Innovación Social,pos,0.726
2019-10-26T14:46:17.000Z,Participantes del encuentro destacaron el trabajo que viene desarrollando la y expresaron la necesidad de que exista un interlocutor entre la Secretaría y el sector de la industria creativa a fin de coordinar acciones que potencien la innovación turística,pos,2.475
2019-10-25T17:53:13.000Z,Esto es una innovación tecnológica que inició el miércoles Esto va a ir creciendo y ya ha comenzado a funcionar viceministro de Transporte en #ElSalón ,pos,0.313
2019-10-25T17:14:37.000Z,Diseña tu espacio Q Style La innovación está en los detalles #Abacel #Samsung #DistribuidorOficial,pos,0.25
2019-10-25T01:15:02.000Z,En fivesteam nuestro principal objetivo desarrollar la cultura de la creatividad y sembrar las semillas de #innovacion mediante engineering y design thinking para niñ en Rakiura… ,pos,1.327
2019-10-24T18:54:30.000Z,Hay mucho trabajo por hacer ya que el concepto no está legitimado menos aún institucionalizado en nuestro país Debemos entender que los ecosistemas de innovación no son espontáneos son productos de politicas firmes planificación reglamentos adecuada y programas de incentivo,pos,2.392
2019-10-24T13:08:55.000Z,INNOVACIÓN social empresarial de la gestión pública hay que escuchar a las personas a la comunidad “Hay que salir de la oficina” “Generar empatía” ,pos,1.456
2019-10-22T12:40:26.000Z,Muchas gracias por la entrevista Alentamos a todos los Pyos a crecer a través de la innovación y la calidad hay mucho por hacer ,pos,1.125
2019-10-22T12:31:31.000Z,“La innovación es importante para los equipos de Auditoría Interna” Fabián Pedrozo Gerente de Auditoría Interna de en el #CLAI ,neu,0
2019-10-16T23:30:24.000Z,Hoy vistamos una organización que busca un acceso a una educación de calidadque fortaleciendo el pensamiento críticoel compromiso con la sociedadla creatividad y la innovacióncreando consciencia y educando para tener un acceso una mejor calidad de vida,pos,1.725
2019-10-16T18:41:54.000Z,Cervepar lanza Accelerator un concurso de innovación para emprendedores ,neg,-0.375
2019-10-16T18:32:00.000Z,Cervepar en alianza con Koga y con el apoyo de Pacto Global Paraguay lanzó el concurso de innovación abierta Accelerator que busca impulsar el progreso y la innovación mediante el apoyo a emprendimientos ,pos,1.3279999999999998
2019-10-16T18:28:53.000Z,Estamos en comunicación con Adi Mindikowski jefe de Asuntos corporativos y legales de quien nos comenta sobre el lanzamiento de Accelerator concurso de innovación abierta para emprendedores ,neu,0.0
2019-10-16T13:07:48.000Z,Feliz Desde tempranito trabajando como maestra de ceremonias de la jornada de innovación empresarial de la mano de ,pos,1.319
2019-10-15T14:43:50.000Z, pregúntale si hay algún plan de innovación para eliminar los eternos tickets o vales de combustible que se usan como cajero automático con los playeros Con la tarjeta de flota se puede adaptar anillos de control al tanque del móvil que si puede recibir la carga,pos,1.676
2019-10-06T18:49:43.000Z,Hoy nuestra Consultora en Innovación cuenta su historia de vida en una charla organizada por #GirlPowered,pos,0.375
2019-10-06T15:31:21.000Z,Estas nuevas herramientas de conocimiento debemos promover e incentivar de acuerdo a las necesidades del mercado Tenemos que familiarizarnos con la innovación y dejar nuestra zona de confort,pos,1.708
2019-10-06T03:16:27.000Z,¡Qué gusto ir a Una verdadera fiesta de #creatividad #innovación #emprendimiento y #tecnología Made in ¡Por más eventos que nos encuentren unidos y nos motiven a seguir promoviendo #innovación y #tecnología para transformar nuestro país #TigoCampusParty,pos,3.027
2019-10-05T11:18:14.000Z,Delchaco la innovación fluvial para el transporte ,neu,0
2019-10-05T00:27:56.000Z,Continuamos desde la arena de #TigoCampusParty con miles de jóvenes paraguayos aficionados a la tecnología y la innovación,neu,0
2019-10-04T20:56:31.000Z,Muchas gracias por la invitación y a tod l que siguieron la charla sobre #storytelling Cuánta energía #innovacion #TigoCampusParty,pos,0.975
2019-09-30T12:06:33.000Z,Te gustaría formar parte del Equipo Impulsor para elaborar la Estrategia Nacional de #Innovación Buscamos personas destacadas de la academia el sector civil y el empresarial que Ad Honorem aporten su tiempo y conocimientos Postulá hasta el viernes ,pos,1.3370000000000002
2019-09-28T19:09:08.000Z,Un privilegio poder implementar innovación tecnología en la producción horticola para seguir avanzando con lo mejor para nuestro país un orgullo poder participar de éste proyecto ,pos,0.35
2019-09-28T00:08:32.000Z,Culminamos semana c una conversación informal e jóvenes del ecosistema de innovación y tecnología y Zheng Huang visitante de Silicon Valley hablamos de las fortalezas y desafíos para crecer su experiencia p fortalecer nuestras iniciativas ,neu,0.0040000000000000036
2019-09-27T22:17:01.000Z,Premio a la Innovación en el #encuentromipymes con Briam Falcó de to año de Business Informatics como jurado Unión Industrial Paraguaya UIP ,pos,0.5
2019-09-27T21:35:40.000Z,Coahing Innovacion en Unión Industrial Paraguaya UIP ,neu,0
2019-09-13T23:36:03.000Z,Me siento privilegiada amola ustedes me vieron crecer hoy estoy orgullosa de ser embajadora del Coaching Paraguayo amo mi tierra mi gente y quiero sembrar innovación y transformación en nuestro Paraguay así como lo están haciendo udsGracias por este encuentro,pos,1.0
2019-09-13T01:30:33.000Z,Un gusto exponer en el “Diplomado en Procesos de #Innovación en #EconomíaCreativa” Conocí profesionales de distintas ramas interesados en darle valor agregado y económico a sus proyectos creativos Esfuerzo coordinado entre #InstitutoDesarrollo #FundaciónCIRD y ,pos,1.3130000000000002
2019-09-12T20:50:12.000Z,Muchas felicidades a la Primera Promoción de Egresados de nuestro Curso de Oratoria una Innovación que generó la Coordinación de Emprende del dirigida por el Abog Javier Doldan y el Prof ,pos,1.208
2019-09-12T20:02:47.000Z,“La innovación no es otra cosa que hacer las cosas diferentes para bien” Gloria Ortega#IdeasQueNosConectan #GramoExponegecios,pos,1.125
2019-09-11T23:18:03.000Z,¡Viví la experiencia de la innovación en el descanso con los beneficios que la Cooperativa Universitaria y Materassi te brindan de manera exclusiva Comprando con tus #TarjetasDeCréditoCU ,pos,1.896
