postDates,tweets,sentiment_label,polarity_score
2019-09-11T22:06:24.000Z,Muy inspiradora la Gran Final del Open Talent y Gran plataforma que muestra al los mayores talentos paraguayos ¡Por más espacios como este y por más apuestas a nuestro ecosistema de #innovación ¡Gracias por la invitación,pos,1.7590000000000001
2019-09-10T22:34:30.000Z,Es momento de sanear todo el sistema de innovacion en el pais Es necesario un cambio generacional de todos los actores Todos deben renunciar incluyendo el consejo Minimo,pos,0.725
2019-08-28T20:54:50.000Z,No gurú yo me tomé cursos de innovación ahí y de izquierda no tienen nada Al contrario financian a empresas y proyectos que sean rentables Yo llevé jn proyecto de enseñanza gratuita y no me financiaron nada por no generar monetización A frigorífico guaraní le dieron mil us,pos,1.0939999999999999
2019-08-28T00:46:58.000Z,Iniciamos el diálogo para la confirmación de la ESTRATEGIA NACIONAL DE INNOVACIÓN en el #ParaguayDeLaGente ,pos,0.25
2019-08-27T23:47:29.000Z,En este momento se está presentado el proceso acordado colectivamente para comenzar a trabajar en la Agenda Nacional De Innovación #InnovaPy,pos,0.725
2019-08-27T23:42:57.000Z,#iaños INDUSTRIAS de INNOVACION con el gran Genio #AYO Gracias por la invitación,pos,0.688
2019-08-27T23:40:08.000Z,Usan tanto la palabra innovación últimamente que tengo miedo que la rompan,neu,0
2019-08-27T22:50:31.000Z,Iniciamos el diálogo para la confirmación de la ESTRATEGIA NACIONAL DE INNOVACIÓN en el #ParaguayDeLaGente ,pos,0.25
2019-08-14T00:15:20.000Z,#LaFrase #GramoEdición#innovación,neu,0
2019-08-13T20:26:52.000Z,Un importante paso para poner a la #innovación como prioridad de Gobierno ,neg,-0.375
2019-08-13T10:33:36.000Z,La tecnología y la innovación deben ser significativas y accesibles Vea nuestras herramientas del comercio para crear soluciones para los desafíos de desarrollo global de nuestro tiempo ,pos,1.221
2019-08-10T22:03:01.000Z,Hoy nos divertimos y aprendimos en el en un espacio de #innovación #creatividad #invención y #arte ¡La #EconomíaNaranja en su máxima expresión #AsuncionMakerFaire,pos,1.1560000000000001
2019-08-10T19:06:34.000Z,IndustriaSinónimo de trabajo empleo desarrollo innovación mejora económica y todo lo que contribuya a un país mejorFelicidades y toda la familia,pos,1.492
2019-08-09T13:30:44.000Z,En seguimos trabajando de forma intensiva generando #CapitalHumano Culmina el do grupo de especialización en Innovación de la Gestion Educativa en la se prepara p salir el ero completando así profesionales del #ParaguayDeLaGente,pos,1.763
2019-08-05T23:00:50.000Z,Pero el gobierno suizo sí creó los puentes necesarios entre las universidades incubadoras y la industria “Puentes” programas incentivos políticas que unen estudiantes laboratorios empresas e inversionistas para que puedan dirigir mejor el timón de la #innovación,pos,0.5
2019-08-05T22:41:45.000Z,En Suiza el gobierno no dirige la #innovación Eso lo deja en manos de los centros de investigación y las empresas inclusive las decisiones de fondos públicos para la innovación,pos,0.438
2019-07-26T01:43:28.000Z,Agradecemos la visita a nuestras oficinas del Viceministro de Miguel Martin y al Director de Innovación y Economía Digital Sebastian O Fiorio para debatir con miembros de la Camara Paraguaya de Fintech el alcance sobre #agendadigital,neu,0
2019-07-24T13:03:09.000Z,Es imposible tenerle pena a un grupo de personas que se rehusa a unirse a la innovación y con una visión tan corta La solución es muy simple que regulen sus precios y mejoren su servicio No se pueden retrasar avances como MUV y Uber la única manera de competir es renovarse,neg,-0.5940000000000001
2019-07-24T11:06:06.000Z,Van a aprobar una ordenanza razonable en la Junta Municipal distinta a propuesta inicial hecha a medida de roscas taxistas Aunque a varios les pese se ven obligados a dar la espalda a negociados y chantajes para escuchar el reclamo ciudadano de abrir puertas a la innovación,pos,0.43799999999999994
2019-07-24T10:49:43.000Z,Aunque lo hagan a regañadientes hoy los Concejales retroceden a su delirio inicial de cerrar puertas a y y ceden ante el reclamo ciudadano para abrir puertas a la innovación En unos días reforzamos con una Ley moderna en el Congreso Lindo día Paraguay,pos,1.203
2019-07-24T03:51:22.000Z,En #Paraguay buscamos igualdad en oportunidades laborales con una iniciativa de regular la innovación tecnológica y avances en servicios de #transporte ,pos,0.313
2019-07-24T00:52:54.000Z,#NiMUVniUBERniTaxi se viene el KarumbeMoto Y noooo Inaceptable la innovación que atenta contra la cultura aguante la ciudad andariega y culta Hombre creó Karumbemoto en Villarrica vía ,pos,0.10800000000000004
2019-07-22T14:05:44.000Z,¡Escuchá nuestro nuevo PodcastEntrevistamos a experto en OTT e Innovación Digital sobre la TV por streaming y el futuro de la televisión O en Spotify TuneIN Apple,pos,0.25
2019-07-22T02:30:21.000Z,No hay que poner ninguna traba a la innovación Lo que hay que hacer es desmontar el sistema corrupto que es negocio para varios políticos y dirigentes del gremio taxista Eliminar el sistema corrupto asegurará igualdad de oportunidades para todos,neg,-0.5840000000000001
2019-07-21T18:06:04.000Z,#Expo Con masiva participación de visitantes en el stand de #ItaipuBinacional se desarrolló la charla sobre “Computación Ubicua” a cargo de los profesionales del área de Tecnología de la Información y Comunicación del #PTIPy #TecnologíaParalaGente#Innovación,pos,0.625
2019-07-21T13:12:40.000Z,#ExpoHoy en el stand de la #ItaipuBinacional tendremos charlas innovadoras a cargo de los profesionales del #PTIPy ¡Te esperamos #TecnologíaParalaGente #Innovación,pos,0.5
2019-07-20T17:55:36.000Z,Charlas de innovadores del PTI en el stand de Itaipu Binacional en la Expo MRA #Expo#TecnologíaParalaGente#ItaipuBinacional #Innovación #PTIPy,pos,0.5
2019-07-19T00:44:44.000Z,#Expo promocionando las “carreras del futuro” con tecnología aplicada y con mucha #innovación #steam Nos conectamos #academia #Industria y #gobierno ,pos,0.375
2019-07-18T17:33:51.000Z,No se puede hacer frente a la innovación de esta manera Es una guerra perdida A la innovación sólo podes enfrentarla con mejores innovaciones,neg,-0.25
2019-07-18T03:09:12.000Z,La Noche de la Innovación se llevó a cabo en #LaGranEstación stand del CONACYT en la Expo MRA En la ocasión fueron presentados al público varios proyectos con base tecnológica que son ejecutados por el programa PROINNOVA del CONACYT ,pos,0.501
2019-07-18T01:03:25.000Z,#Expo En el stand de #ItaipuBinacional el Ing Juan Domanizcky del #PTIPy habló sobre “Ruta Verde” con el fin de incentivar la movilidad eléctrica en El país aprovechando la abundante energía limpia y renovable de Itaipu #TecnologíaParalaGente #Innovación,pos,1.7810000000000001
2019-07-17T21:04:41.000Z,#Expo En estos momentos culminó el taller para niños “Desarrollando el Pensamiento Computacional” a cargo de los profesionales del #PTIPy en el stand de #TecnologíaParalaGente #Innovación #ItaipuBinacional,neu,0
2019-07-16T23:42:52.000Z,Yacyretá recibe el premio al mejor stand en tecnología e innovación por parte de la Comisión Coordinadora Central de la XXVIIIa edición de la En nombre de la EBY recibe el Consejero Víctor Miranda Ocampo recibe el galardón,pos,0.875
2019-07-10T21:47:39.000Z,La y la firmaron un convenio para implementar programas proyectos y actividades de apoyo interinstitucional para innovación de procesos de rendición de cuentas Rubricaron el documento el Director de la EBY y el Contralor ,pos,0.725
2019-07-10T16:48:06.000Z,El mismo tiene por objeto implementar programas proyectos y actividades de apoyo interinstitucional en los que se fomente la cooperación y colaboración para el desarrollo de políticas orientadas a la innovación de los procesos de rendición de cuentas a la CGR,pos,0.506
2019-07-10T14:14:55.000Z,Plan vs Real en Excelencia en Innovación en Pasión en Intensidad en Ambición en Equilibrio Mi familia Henói Lo logramos #Handover en Asunción Paraguay ,pos,0.35
2019-07-10T11:51:17.000Z,Otro “Premio a la Innovación” de Se suma a y y casualmente las tres tocan algún botín político Qué otra iniciativa innovadora conocen que haya surgido y la misma Municipialidad se haya encargado de trancar,pos,1.25
2019-07-10T11:21:23.000Z,Los servicios que prestan MUV y UBER no pueden ser prohibidos o eliminados Estar en contra de la innovación es una empresa sin futuro Los taxistas de Asunción han demostrado ser abusivos en su accionar y desmedidos en sus reclamos,neu,0.0
2019-07-10T02:44:19.000Z,Yo estoy re a favor de los taxistas no puede ser que el crecimiento y la innovación cambie nuestro país nos merecemos nada Abraza a un taxista ANGÁ,pos,0.31299999999999994
2019-07-08T15:28:03.000Z,#CampusParty viene a Paraguay y se suma a los países que viven la experiencia de la innovación,pos,0.333
2019-07-08T12:59:52.000Z,#Expo Te esperamos hoy para las charlas sobre Experiencias de Divulgación Científica Discapacidad en la Era Digital y Actuación en Geolocalización que se realizarán en nuestro stand La temática es Innovación #ITAIPUBinacional#EnergíaParaLaGente,pos,0.583
2019-07-07T00:41:34.000Z,Test de innovación para emprendedores Un elemento que resulta útil para medir la capacidad innovadora Dinámicas de Creatividad Intercambios lúdicos para potenciar la capacidad que los emprendedores tengan para poder encaminar mejor sus ideas de negocios,pos,2.364
2019-07-05T16:57:20.000Z,“El valor de la innovación no está en evitar que te copien sino conseguir que todos te quieran copiar” años trabajando para y con nuestros Asegurados,pos,0.6
2019-06-08T12:41:10.000Z,Marca paraguaya con nivel y jerarquía internacional innovación y buen gusto en el deporte ,pos,1.5
2019-06-08T01:37:00.000Z,Innovación o extinción ,neu,0
2019-06-04T17:45:24.000Z,Con materassicolchones #reinventamoseldescanso #momentosmaterassi #boyteks #calidad #innovación #confort en Asunción Paraguay,pos,0.75
2019-06-04T16:07:03.000Z,Hoy en #AlFiloDelMedioDía compartimos la mesa con Federico Mora y analizamos el programa de becas al exterior para la investigación innovación y fortalecimiento de la educación En vivo de a hs desde Radio Chaco Boreal ,pos,0.5800000000000001
2019-06-02T13:55:11.000Z,Estan los influencers y los qe dan charlas de innovación y también esta Perelman No me interesa el dinero ni la fama no quiero estar en exhibición como un animal en un zoológico ,pos,0.08299999999999996
2019-05-17T20:08:39.000Z,Viernes InnovaciónEl minidrone AirSelfie permite hacer selfies a distintas alturas INNOVAR IMPACTAR INSPIRAR,neg,-0.25
2019-05-12T00:30:11.000Z,Esta es la innovación que buscamos Me entero q es paraguaya ,pos,0.271
2019-05-11T01:33:39.000Z,Viernes Innovación CoCoon de BeeLife es una colmena con un sistema térmico activo y características IoT CoCoon ayuda a las abejas a vivir más tiempo a cosechar más miel y a vivir en un hábitat completamente adaptado además de combatir Varroa el ácaro que acaba con,neg,-0.125
2019-05-07T22:15:09.000Z,¡ es el evento de Innovación más internacional y más relevante de la Región y vos no podés faltar,neu,0.0
2019-05-07T16:07:54.000Z,Otro antecedente junto al de la pelea del Pigu Garay y hace más de años Claramente no fue una innovación lo de #CaneloJacobs además de que en el reglamento figura hace casi Muy buena esa memoria Marcelo,neg,-0.18100000000000005
2019-04-08T20:09:07.000Z,Consuelo Merino Scrum Master Diseñadora de productos lider de Equipos en Software Natura Experiencia en proyectos de innovación para USA y desarrollos utilizando tecnologias en la nube Conocela MUJERES EN TECNOLOGÍA Inscribíte gratis ,pos,0.45799999999999996
2019-04-07T19:12:29.000Z,Innovación inversión y fuentes de trabajo vs Prebendarios Nepotismo y Corrupción vos elegís entre el Éxito o el Fracaso Pasado o Futuro esa es TU ELECCIÓN,pos,0.2599999999999999
2019-04-04T02:29:29.000Z,Gracias a y a por acompañarnos en el Taller de Innovación Tecnológica en el auditorio de la UIP Estuvo genial #orclapex,pos,1.324
2019-04-02T00:53:35.000Z,Más que innovación tecnológica necesitamos innovación social Urgente,pos,0.706
2019-03-31T14:24:21.000Z,Gracias por hablar de y compartir mi experiencia de años en acceso a la información rendición de cuentas innovación y participación ciudadana y lo MÁS importante tener todos la misma camiseta ,pos,0.933
2019-03-29T00:06:47.000Z,Estamos trabajando para Usted innovación como no podía ser de otra manera #turismo,pos,0.35
2019-03-14T15:08:52.000Z,Nos invitaron a una feria de innovación en China y si ellos dicen que es innovador tiene que ser innovador dice Mateo #BudxFutureTrends #WhatsNext,pos,1.0
2019-03-13T23:49:02.000Z,Recibe el galardón de MICROEMPRESAS EXITOSAS Viviana Mendoza es propietaria de Florencia Los diseños de Viviana se destacan por su innovación practicidad y belleza posicionando a Florencia entre las marcas más importantes en la moda nacional,pos,1.0
2019-03-13T00:39:12.000Z,Había que ganarle a U de Concepción para no perder la calma Equipo en baja se nos cierran y nos sabemos que hacer innovación A mover piezas Profe Garnero,neg,-0.10899999999999999
2019-03-10T21:46:46.000Z,TALLER INTERVENCIÓN SOCIAL SOSTENIBLE CUÁNDO JUEVES de a hsSobre innovación social aplicado en proyectos de desarrollo comunitario con psicólogo clinico especialista en metódologias educativas para jovenes en situación de riesgo,pos,2.662
2019-03-10T00:11:59.000Z,#Innovación para la #Igualdad es el llamado de si es así esperaremos los mejores cambios transformadores y nuevas soluciones para la mayor inclusión femenina en la sociedad ,pos,0.6
2019-03-08T19:25:23.000Z,A pocos días de los #PremiosADEC certamen que cada año distingue a empresas y empresariosas que realizan un importante aporte a nuestra sociedad al obtener resultados extraordinarios dentro de su sector la innovación y la RSE,neg,-0.5
2019-03-08T12:25:12.000Z,Tras varias transmisiones de la Copa Libertadores realizadas a través de Facebook Estás de acuerdo con esta innovación,pos,0.625
2019-02-08T18:48:44.000Z,Leo innovación y ya me falta el aire,neg,-0.5
2019-02-07T14:08:20.000Z,Con el objetivo de emprender acciones coordinadas entre el MIC la Municipalidad y la Gobernación de Caaguazú los Viceministros y visitan Caaguazú con miras al progreso innovación y generación de fuentes de trabajo para los pobladores de la zona,pos,0.9129999999999999
2019-02-02T13:42:30.000Z,Arrancamos el segundo bloque con nuestro invitado #JuanManuelBrunetti Presidente del Consejo de Administración de la Universidad San Carlos Vamos a estar hablando de #Innovación en la educación,neu,0.0
2019-01-31T23:59:14.000Z,#DobleE #E En el evento vamos a exponer diferentes metodologías ágiles d innovación con la q pueden contar las instituciones p mejorar sus experiencias en el servicio d desarrollo #emprendedor y con microempresariosVienen desde Europa #PeterSonderegger y ,pos,0.593
2019-01-25T14:02:31.000Z, El premio de economía creativa que hoy se entrega es el reconocimiento a los emprendedores que se animan a presentar sus proyectos de innovación social para sus comunidades Con esto buscamos que las instituciones se consoliden y llevar de ejemplo a todo el país,pos,2.057
2019-01-25T13:25:04.000Z,El objetivo del concurso es desarrollar proyectos tecnocreativos de inclusión social para mejorar la comunidad Los criterios que se tuvieron en cuenta fueron la innovación creatividad tecnología diseño modelo y plan de negocio impacto social y potencial de crecimiento ,pos,1.7550000000000001
2018-12-20T21:26:48.000Z,Todos los canales hablan de innovación y pea q amoa ves los programas y es todo lo msmo desde hace años por lo menos,pos,0.5
2018-12-19T02:02:12.000Z,#MasterChefPY chipa guazú en una final creatividad innovación,pos,0.625
2018-12-19T00:23:11.000Z,La UPAP en conjunto con el Centro de Investigación e Innovación presenta una destacada publicación sobre Robótica Inteligencia Artificial y el Futuro del Derecho del Dr Marcelo Corrales Director del Centro de Investigación e Innovación ,pos,0.275
2018-12-15T12:20:05.000Z,Todo el apoyo para el equipo de ante los ataques del concejal anti innovación No podemos más seguir permitiendo que políticos improvisados y con mentalidad retrógrada como éste intenten regular la vida de los habitantes de Asunción,pos,1.2309999999999999
2018-12-15T11:27:39.000Z,Creemos en la #innovación como fuerza transformadora capaz de mejorar la calidad de vida de las personas Empresarios Academia y Gobierno coordinando y pensando JUNTOS donde queremos llegar #InnovaPy,pos,1.7650000000000001
2018-12-14T11:56:23.000Z,Pese a la alta demanda que hubo esta mañana a estas horas siempre son menos los muvers conectados La iniciativa es genial de ganancia para ellos de parte de la empresa Taxis o cualquier servicio debería entender que la competencia y la innovación llegó ,pos,0.23699999999999988
2018-12-04T16:10:12.000Z,APROBADO pedido de informe a para entender intención de perseguir iniciativas PRIVADAS como y sobre otros servicios de transporte en la ciudad No podemos ir contra la innovación como opción de trabajo para jóvenes y medio de transporte para asuncenos,pos,1.475
2018-12-04T14:13:51.000Z,“No se puede perseguir a la innovación no se puede ir en contra del espíritu emprendedor de los jóvenes paraguayos” ,neu,0.0
2018-12-04T13:53:45.000Z,Impulsamos esta iniciativa entre el sector público y privado La Movilidad Eléctrica es industria tecnología e innovación ahorro menor dependencia energética y mayor calidad ambiental Llegó para ser el futuro y debemos anticiparnos para que llegue bien y en beneficio de todos,pos,3.5009999999999994
2018-12-04T02:39:52.000Z,Por favor no seamos de cuarta q la mafia no le gane a innovación dejemos de dar hermosos discursos y hagamos algo dejemos de ser aldeanos y seamos ciudadanos del mundo Les pido a todos los verdaderos patriotas que apoyen y usen apps como no se dejen intimidar,pos,2.4699999999999998
2018-12-03T22:29:36.000Z,Que recurso’i de y la con el argumento del marco legal para frenar a y Uber Uno de los mayores frenos al incentivo del desarrollo de la innovación son las legislaciones desfasadas y la burocracia inútil,neg,-0.333
2018-12-03T21:47:00.000Z,Comunicado de la Asociación de Emprendedores del Paraguay sobre la postura municipal contra la innovación ,neu,0
2018-12-03T20:17:52.000Z,Por qué se teme tanto a la innovación De parte de todo el equipo de y ,neg,-0.051999999999999935
2018-12-03T17:03:03.000Z,#Investigación #desarrollo #innovación mejoran las prestaciones y los beneficios ambientales para lograr una verdadera #economiacircular en las #carreteras ,pos,1.4840000000000002
2018-12-03T16:57:16.000Z,#Investigación #desarrollo #innovación mejoran las prestaciones y los beneficios ambientales para lograr una verdadera #economiacircular en las #carreteras ,pos,1.4840000000000002
2018-11-29T21:50:15.000Z,Tenemos un vivero de innovación con nuestras oficinas en todo el país No hay organización financiera en el mundo que haya alcanzado la nota máxima en la medición de microfinanzas sociales en la entrega de los Premios Visionarios Juscelino Kubitschek ,pos,1.268
2018-11-19T16:33:40.000Z,Con el equipo de #ParticipaPY Luca Cernuzzi Marcelo Alcaraz recibimos mención honorífica del Premio Nacional de Ciencia otorgado por el Congreso Nacional a nuestro trabajo Tecnología Cívica para la Innovación Social ,pos,2.8370000000000006
2018-11-18T23:03:18.000Z, te espera para compartir las buenas prácticas sobre innovación en territorio #InnovAcción Estarán representantes de de Chile Confirma tu presencia en ,pos,1.313
2018-11-11T16:56:11.000Z,Centros de incubación universidades StartUps innovación economía creativa atracción de inversiones emprendimientos sociales y proyectos empresariales ahora en la prioridad del Gobierno NacionalEl #ParaguaydeLaGente va dar ese salto cualitativo y sumamente importante,pos,1.393
2018-11-08T19:54:19.000Z,Presentación de mi ponencia La Propiedad Intelectual y la Innovación en la academia en el marco del III Encuentro de Investigadores de la Sociedad Científica del… ,pos,1.2189999999999999
2018-11-07T11:51:35.000Z,Estoy en el IBM innovation day y la presentación la hacen con un Mac ohh será esa la innovación,neg,-0.375
2018-11-06T10:43:24.000Z, de a reducción de las diferencias con los países más avanzados de a refuerzo de la posición china de a convertirse en vanguardia de la innovación mundial,pos,0.275
2018-11-01T17:27:40.000Z,Reunión con el director de Innovación de GLOBALIA Luis Ureta con respecto a la implementación de acciones conjuntas entre Paraguay y la prestigiosa organización internacional,pos,0.938
2018-10-28T22:47:25.000Z,Jair Bolsonaro dio su primer discurso como Presidente electo de Brasil vía Facebook Live Potente señal a los medios tradicionales La innovación en la comunicación es urgente,neg,-0.312
2018-10-27T11:55:41.000Z,Revisando el plan siendo más ambiciosos acciones concretas para todos nosotros #datos #mejorcalidadevida #aip #innovación,pos,0.25
2018-10-08T21:07:07.000Z,#InteligenciaArtificial al servicio de la #Educación #Innovación,pos,0.25
2018-10-07T22:42:33.000Z,Hoy me puse a analizar a Apple desde la salida de Steve Jobs y me di cuenta que la innovación quedó decadente piensan que yo me voy a comprar un nuevo modelo por el solo hecho de que su cámara saca con profundidad I’m mean C’MON DUDE,neg,-0.202
2018-10-06T14:37:35.000Z,En el segundo bloque nos acompaña Mauri Rivas co fundador de MUV Hablamos sobre su emprendimiento y está innovación en nuestro país,neu,0.0
2018-10-05T13:20:25.000Z,En #ideAccion de la mano de Más de personas demuestran que el emprendimiento y la innovación cotiza al alza en #Paraguay #movamosalmundo,neu,0
2018-10-05T03:24:26.000Z,Aplausos de pie para Eleva la vara muestra el camino disipa el humo y nos invita a mejorar en calidad e innovación Salud y que sigan éxitos,pos,2.014
2018-10-04T03:37:19.000Z,Innovación emprendedurismo Paraguay necesita más “Marcos Riquelmes” más galletitas más mercados más jóvenes que agreguen con sus talentos valor a nuestros productos ,pos,0.458
2018-10-03T13:22:09.000Z,Con la presencia del Presidente y el Ministro presentamos buses km de la línea XIMEX SA con rampas para personas con discapacidad aire acondicionado y servicio de WiFi Los usuarios se merecen Transporte de calidad seguridad e innovación,pos,0.688
2018-09-28T22:02:57.000Z,El #DíaMundialdelTurismo se celebró ayer de septiembre en Budapest Hungría con una ceremonia centrada en la transformación digital en el turismo una prioridad de la Se abordó cómo la inversión en nuevas tecnologías brinda oportunidades de innovación al sector,pos,0.25
2018-09-28T15:43:46.000Z, Un honor ser parte del Desde la innovación se volvió parte integral de nuestro ADN Evolucionamos constantemente para llegar hasta vos a través de múltiples plataformas porque donde estás vos estamos nosotros #SNTAños,pos,0.375
2018-09-27T18:45:52.000Z,La ministra de turismo participó en el festejo de la por el #DiaInternacionalDelTurismo en Budapest Durante un panel se enfocó en la creación de productos acordes al turismo creatividad emprendedurismo innovación y nuevas tecnologías,pos,1.0
2018-09-13T13:58:10.000Z,Diálogo de Tecnología e Innovación Educativa con Fabricación Digital y Espacios Maker#añosPyEduca,pos,0.563
2018-09-13T10:31:12.000Z,Nos quedan lugares para el curso de INNOVACIÓN Todo listo para hoy Más Info ,pos,0.637
2018-09-12T17:53:33.000Z,Excelente evento de clase mundial el primer paso a la innovación es la inspiración #ideasqueconectan en Paseo La Galería,pos,1.025
2018-09-11T21:25:24.000Z,La innovación es el único camino para ganar ,pos,1.058
2018-09-09T15:08:00.000Z,#Repost getrepost・・・Morena Toro en el desfile de PRODIAFW Hoy a partir de las hs en el #morenatoro #prodi #diseño #innovación #Paraguay en Hotel… ,neu,0
2018-09-07T22:00:27.000Z,VI Congreso Regional Internacional Innovacion Educativa Nuevos Retos hacia una Educacion de Excelencia en Polideportivo Municipal Paraguarí ,pos,0.18799999999999994
2018-09-07T21:01:44.000Z,Innovación Es tan fácil es tan lindoBien por y el ,pos,0.25
2018-09-06T12:36:38.000Z,Este jueves queremos mostrarte nuevas técnicas de innovación que mejoren tu gestión Responder cómo hacer mejor lo qué haces es lo que queremos hacer Inscribite #AccionCapacita ,pos,1.1560000000000001
2018-08-25T19:42:53.000Z,Sección innovación de la revista Vida Gracias revistavidauhpablenchamorro #electricbike #interview #innovacion #innovation… ,pos,0.35
2018-08-25T19:39:40.000Z,Buenísima la nota en la sección innovación de la revista Vida Gracias revistavidauh pablenchamorro ••••••••••••#quasarpy #electricbike #interview… ,pos,0.35
2018-08-25T19:35:49.000Z,Buenísima la nota en la sección innovación de la revista Vida Gracias revistavidauh pablenchamorro Asunción Paraguay ,pos,0.35
2018-08-23T12:22:37.000Z,La Tríada Universidades latinoamericanas forman alianza para impulsar la innovación educativa y la investigación ,pos,0.563
2018-08-23T00:18:19.000Z,Mayor cantidad y calidad de investigación científica genera el crecimiento de la innovación Laura Altschuler#cacopi #emprendedurismo #innovacion,pos,0.5
